{
  "$schema": "http://json-schema.org/draft-07/schema#",
  "title": "Epstein Files Document Metadata",
  "type": "object",
  "required": [
    "id",
    "title",
    "source_name",
    "source_url",
    "release_date",
    "downloaded_at",
    "sha256",
    "file_path",
    "mime_type",
    "pages",
    "tags",
    "notes",
    "is_official",
    "license_or_terms",
    "sources"
  ],
  "properties": {
    "id": {"type": "string"},
    "title": {"type": "string"},
    "source_name": {"type": "string"},
    "source_url": {"type": "string", "format": "uri"},
    "source_page": {"type": ["string", "null"], "format": "uri"},
    "release_date": {"type": "string"},
    "downloaded_at": {"type": "string"},
    "sha256": {"type": "string", "pattern": "^[a-f0-9]{64}$"},
    "file_path": {"type": "string"},
    "mime_type": {"type": "string"},
    "pages": {"type": ["integer", "null"]},
    "file_size_bytes": {"type": ["integer", "null"]},
    "pdf_type": {"type": ["string", "null"], "enum": ["text", "image", "hybrid", null]},
    "has_extractable_text": {"type": ["boolean", "null"]},
    "ocr_applied": {"type": ["boolean", "null"]},
    "text_quality_score": {"type": ["number", "null"], "minimum": 0, "maximum": 100},
    "extracted_file_numbers": {"type": "array", "items": {"type": "string"}},
    "extracted_dates": {"type": "array", "items": {"type": "string"}},
    "extracted_entities": {
      "type": ["object", "null"],
      "properties": {
        "people": {"type": "array", "items": {"type": "string"}},
        "organizations": {"type": "array", "items": {"type": "string"}},
        "locations": {"type": "array", "items": {"type": "string"}}
      }
    },
    "document_category": {"type": ["string", "null"]},
    "tags": {"type": "array", "items": {"type": "string"}},
    "notes": {"type": ["string", "null"]},
    "is_official": {"type": "boolean"},
    "etag": {"type": ["string", "null"]},
    "last_modified": {"type": ["string", "null"]},
    "content_disposition": {"type": ["string", "null"]},
    "license_or_terms": {"type": "string"},
    "sources": {
      "type": "array",
      "items": {
        "type": "object",
        "required": ["source_name", "source_url"],
        "properties": {
          "source_name": {"type": "string"},
          "source_url": {"type": "string", "format": "uri"}
        }
      }
    }
  }
}
