{
  "content_disposition": "",
  "downloaded_at": "2026-02-07T11:16:21+00:00",
  "etag": "\"fddef2bb1a9e2a9645ea258d19b4bea7\"",
  "file_path": "data/raw/02cec58b0a74-utilities-efta02212892pdf/EFTA02212892.pdf",
  "id": "02cec58b0a74-utilities-efta02212892pdf",
  "is_official": true,
  "last_modified": "Fri, 30 Jan 2026 05:40:14 GMT",
  "license_or_terms": "as published by source",
  "mime_type": "application/pdf",
  "notes": "DOJ Epstein Library disclosures released under the Epstein Files Transparency Act, including data set files and supplemental releases.",
  "pages": 1,
  "release_date": "2026-01-30",
  "sha256": "02cec58b0a7452f6685978cd9ac2efcb1975130ab1f35601426b6f73c99cac38",
  "source_name": "DOJ Epstein Library \u2014 DOJ Disclosures",
  "source_page": "https://www.justice.gov/epstein/doj-disclosures/data-set-11-files",
  "source_url": "https://www.justice.gov/epstein/files/DataSet%2011/EFTA02212892.pdf",
  "sources": [
    {
      "source_name": "DOJ Epstein Library \u2014 DOJ Disclosures",
      "source_url": "https://www.justice.gov/epstein/doj-disclosures/data-set-11-files"
    }
  ],
  "tags": [
    "doj",
    "epstein-library",
    "doj-disclosures"
  ],
  "title": "Utilities \u2014 EFTA02212892.pdf"
}
