{
  "content_disposition": "",
  "downloaded_at": "2026-02-07T11:38:47+00:00",
  "etag": "\"203fd2ca173c3dc53a4594a2f4e01ae5\"",
  "file_path": "data/raw/89451aaba50f-utilities-efta00009964pdf/EFTA00009964.pdf",
  "id": "89451aaba50f-utilities-efta00009964pdf",
  "is_official": true,
  "last_modified": "Tue, 23 Dec 2025 04:21:52 GMT",
  "license_or_terms": "as published by source",
  "mime_type": "application/pdf",
  "notes": "DOJ Epstein Library disclosures released under the Epstein Files Transparency Act, including data set files and supplemental releases.",
  "pages": 1,
  "release_date": "2026-01-30",
  "sha256": "89451aaba50fb7d46ba9689ab9c33b54c6cd9f057838c508c7560565b32aed7a",
  "source_name": "DOJ Epstein Library \u2014 DOJ Disclosures",
  "source_page": "https://www.justice.gov/epstein/doj-disclosures/data-set-8-files",
  "source_url": "https://www.justice.gov/epstein/files/DataSet%208/EFTA00009964.pdf",
  "sources": [
    {
      "source_name": "DOJ Epstein Library \u2014 DOJ Disclosures",
      "source_url": "https://www.justice.gov/epstein/doj-disclosures/data-set-8-files"
    }
  ],
  "tags": [
    "doj",
    "epstein-library",
    "doj-disclosures"
  ],
  "title": "Utilities \u2014 EFTA00009964.pdf"
}
