{
  "downloaded_at": "2026-02-04T07:13:43+00:00",
  "file_path": "data/raw/55343b7357cb-eeo-policy-statement/Final DOJ EEO Policy (December 2025) 508.pdf",
  "id": "55343b7357cb-eeo-policy-statement",
  "is_official": true,
  "license_or_terms": "as published by source",
  "mime_type": "application/pdf",
  "notes": "Press release with direct links to the first phase of declassified PDFs.",
  "pages": 1,
  "release_date": "2025-02-27",
  "sha256": "55343b7357cbc2cb97bc9e84365bba23d6d546e1f0080739cc327f5a252b0e0c",
  "source_name": "DOJ OPA Press Release \u2014 First Phase Declassified (Feb 27, 2025)",
  "source_url": "https://www.justice.gov/jmd/media/1425556/dl?inline",
  "sources": [
    {
      "source_name": "DOJ OPA Press Release \u2014 First Phase Declassified (Feb 27, 2025)",
      "source_url": "https://www.justice.gov/opa/pr/attorney-general-pamela-bondi-releases-first-phase-declassified-epstein-files"
    }
  ],
  "tags": [
    "doj",
    "opa",
    "press-release"
  ],
  "title": "EEO Policy Statement"
}
