{
  "content_disposition": "",
  "downloaded_at": "2026-02-07T11:20:40+00:00",
  "etag": "\"bbebf3319a5be46e7dc50c86a7fd8bce\"",
  "file_path": "data/raw/7e92647ecf74-utilities-efta02731475pdf/EFTA02731475.pdf",
  "id": "7e92647ecf74-utilities-efta02731475pdf",
  "is_official": true,
  "last_modified": "Sat, 31 Jan 2026 02:43:50 GMT",
  "license_or_terms": "as published by source",
  "mime_type": "application/pdf",
  "notes": "DOJ Epstein Library disclosures released under the Epstein Files Transparency Act, including data set files and supplemental releases.",
  "pages": 2,
  "release_date": "2026-01-30",
  "sha256": "7e92647ecf74da3c61f82b4d36621e1ead562ee64fdd65edc31e157b4bed5859",
  "source_name": "DOJ Epstein Library \u2014 DOJ Disclosures",
  "source_page": "https://www.justice.gov/epstein/doj-disclosures/data-set-12-files",
  "source_url": "https://www.justice.gov/epstein/files/DataSet%2012/EFTA02731475.pdf",
  "sources": [
    {
      "source_name": "DOJ Epstein Library \u2014 DOJ Disclosures",
      "source_url": "https://www.justice.gov/epstein/doj-disclosures/data-set-12-files"
    }
  ],
  "tags": [
    "doj",
    "epstein-library",
    "doj-disclosures"
  ],
  "title": "Utilities \u2014 EFTA02731475.pdf"
}
